{
  "name": "Italian Parliament MCP",
  "repository_url": "https://github.com/ondata/italianparliament-mcp",
  "mcp_endpoint": "https://italianparliament-mcp.andy-pr.workers.dev/mcp",
  "transport": "streamable-http",
  "author": "ondata",
  "language": "TypeScript",
  "license": "MIT",
  "stars": 2,
  "category": "pa-finanza-pubblica",
  "short_description": "Dati del Parlamento italiano",
  "description": "Server MCP per i dati del Parlamento italiano.",
  "tags": [
    "parlamento",
    "camera",
    "senato",
    "typescript",
    "remote-mcp"
  ]
}
