{
  "name": "Filo — Design System Italia",
  "repository_url": "https://github.com/Fupete/design-system-italia-mcp",
  "author": "Fupete",
  "language": "TypeScript",
  "license": "BSD-3-Clause",
  "stars": 3,
  "category": "design-altro",
  "short_description": "Design system .italia (sperimentale)",
  "description": "Server MCP sperimentale e non ufficiale per il Design system .italia.",
  "tags": [
    "design-system",
    "pa",
    "ui",
    "typescript"
  ]
}
