{
  "name": "MCP Fattura Elettronica IT",
  "repository_url": "https://github.com/cmendezs/mcp-fattura-elettronica-it",
  "author": "cmendezs",
  "language": "Python",
  "license": "Apache-2.0",
  "stars": 1,
  "category": "fatturazione",
  "short_description": "FatturaPA: generazione, validazione XSD, firma digitale, invio diretto SDI e supporto alla conservazione",
  "description": "Generazione e validazione XSD di fatture FatturaPA B2B, B2G e transfrontaliere, firma XAdES/CAdES, invio diretto a SDI via SDICoop e supporto alla conservazione sostitutiva.",
  "tags": [
    "fattura-elettronica",
    "fatturapa",
    "sdi",
    "xml",
    "xsd",
    "firma-digitale",
    "conservazione-sostitutiva"
  ]
}
