{
  "name": "MCP Meteo Italia",
  "repository_url": "https://github.com/makremriahi99/MCP-Meteo-Italia",
  "author": "makremriahi99",
  "language": "Python",
  "license": null,
  "stars": 0,
  "category": "design-altro",
  "short_description": "Meteo in tempo reale con FastMCP + Gradio",
  "description": "Server MCP per dati meteo italiani in tempo reale — FastMCP + Gradio, integrabile con Claude.",
  "tags": [
    "meteo",
    "tempo-reale",
    "gradio",
    "python"
  ]
}
