{
  "name": "ANAC MCP",
  "repository_url": "https://github.com/SimonBerg255/anac-mcp",
  "author": "SimonBerg255",
  "language": "Python",
  "license": null,
  "stars": 4,
  "category": "pa-finanza-pubblica",
  "short_description": "Appalti pubblici ANAC (BDNCP)",
  "description": "ANAC Procurement Intelligence — dati sugli appalti pubblici italiani (BDNCP), senza credenziali.",
  "tags": [
    "anac",
    "appalti",
    "procurement",
    "python"
  ]
}
